<?xml version="1.0" encoding="UTF-8"?>
<!DOCTYPE list SYSTEM "npc.dtd">

<list>
  <npc id="31800" name="Adventure Guildsman" title="">
    <set name="aggroRange" value="0"/>
    <set name="ai_type" value="CharacterAI"/>
    <set name="baseAtkRange" value="40"/>
    <set name="baseCON" value="43"/>
    <set name="baseCritRate" value="40"/>
    <set name="baseDEX" value="30"/>
    <set name="baseHpMax" value="2444.468"/>
    <set name="baseHpRate" value="1"/>
    <set name="baseHpReg" value="7.5"/>
    <set name="baseINT" value="21"/>
    <set name="baseMAtk" value="780"/>
    <set name="baseMAtkSpd" value="333"/>
    <set name="baseMDef" value="382"/>
    <set name="baseMEN" value="20"/>
    <set name="baseMpMax" value="1345.8"/>
    <set name="baseMpReg" value="2.7"/>
    <set name="basePAtk" value="1303"/>
    <set name="basePAtkSpd" value="253"/>
    <set name="basePDef" value="471"/>
    <set name="baseRunSpd" value="120"/>
    <set name="baseSTR" value="40"/>
    <set name="baseShldDef" value="0"/>
    <set name="baseShldRate" value="0"/>
    <set name="baseWIT" value="20"/>
    <set name="baseWalkSpd" value="50"/>
    <set name="collision_height" value="21.5"/>
    <set name="collision_radius" value="8.0"/>
    <set name="level" value="70"/>
    <set name="rewardExp" value="0"/>
    <set name="rewardRp" value="0"/>
    <set name="rewardSp" value="0"/>
    <set name="shots" value="NONE"/>
    <set name="texture" value=""/>
    <set name="type" value="Adventurer"/>
    <equip>
      <rhand item_id="156"/>
      <!--Hand Axe-->
      <lhand item_id="20"/>
      <!--Buckler-->
    </equip>
    <skills>
      <skill id="4416" level="14"/>
      <!--Humans-->
    </skills>
    <attributes>
      <defence attribute="fire" value="0"/>
      <defence attribute="water" value="0"/>
      <defence attribute="wind" value="0"/>
      <defence attribute="earth" value="0"/>
      <defence attribute="holy" value="0"/>
      <defence attribute="unholy" value="0"/>
    </attributes>
  </npc>
  <npc id="31801" name="Adventure Guildsman" title="">
    <set name="aggroRange" value="0"/>
    <set name="ai_type" value="CharacterAI"/>
    <set name="baseAtkRange" value="40"/>
    <set name="baseCON" value="43"/>
    <set name="baseCritRate" value="40"/>
    <set name="baseDEX" value="30"/>
    <set name="baseHpMax" value="2444.468"/>
    <set name="baseHpRate" value="1"/>
    <set name="baseHpReg" value="7.5"/>
    <set name="baseINT" value="21"/>
    <set name="baseMAtk" value="780"/>
    <set name="baseMAtkSpd" value="333"/>
    <set name="baseMDef" value="382"/>
    <set name="baseMEN" value="20"/>
    <set name="baseMpMax" value="1345.8"/>
    <set name="baseMpReg" value="2.7"/>
    <set name="basePAtk" value="1303"/>
    <set name="basePAtkSpd" value="253"/>
    <set name="basePDef" value="471"/>
    <set name="baseRunSpd" value="120"/>
    <set name="baseSTR" value="40"/>
    <set name="baseShldDef" value="0"/>
    <set name="baseShldRate" value="0"/>
    <set name="baseWIT" value="20"/>
    <set name="baseWalkSpd" value="48"/>
    <set name="collision_height" value="21.5"/>
    <set name="collision_radius" value="8.0"/>
    <set name="level" value="70"/>
    <set name="rewardExp" value="0"/>
    <set name="rewardRp" value="0"/>
    <set name="rewardSp" value="0"/>
    <set name="shots" value="NONE"/>
    <set name="texture" value=""/>
    <set name="type" value="Adventurer"/>
    <equip>
      <rhand item_id="156"/>
      <!--Hand Axe-->
      <lhand item_id="20"/>
      <!--Buckler-->
    </equip>
    <skills>
      <skill id="4416" level="14"/>
      <!--Humans-->
    </skills>
    <attributes>
      <defence attribute="fire" value="0"/>
      <defence attribute="water" value="0"/>
      <defence attribute="wind" value="0"/>
      <defence attribute="earth" value="0"/>
      <defence attribute="holy" value="0"/>
      <defence attribute="unholy" value="0"/>
    </attributes>
  </npc>
  <npc id="31802" name="Adventure Guildsman" title="">
    <set name="aggroRange" value="0"/>
    <set name="ai_type" value="CharacterAI"/>
    <set name="baseAtkRange" value="40"/>
    <set name="baseCON" value="43"/>
    <set name="baseCritRate" value="40"/>
    <set name="baseDEX" value="30"/>
    <set name="baseHpMax" value="2444.468"/>
    <set name="baseHpRate" value="1"/>
    <set name="baseHpReg" value="7.5"/>
    <set name="baseINT" value="21"/>
    <set name="baseMAtk" value="780"/>
    <set name="baseMAtkSpd" value="333"/>
    <set name="baseMDef" value="382"/>
    <set name="baseMEN" value="20"/>
    <set name="baseMpMax" value="1345.8"/>
    <set name="baseMpReg" value="2.7"/>
    <set name="basePAtk" value="1303"/>
    <set name="basePAtkSpd" value="253"/>
    <set name="basePDef" value="471"/>
    <set name="baseRunSpd" value="120"/>
    <set name="baseSTR" value="40"/>
    <set name="baseShldDef" value="0"/>
    <set name="baseShldRate" value="0"/>
    <set name="baseWIT" value="20"/>
    <set name="baseWalkSpd" value="48"/>
    <set name="collision_height" value="22.4"/>
    <set name="collision_radius" value="9.5"/>
    <set name="level" value="70"/>
    <set name="rewardExp" value="0"/>
    <set name="rewardRp" value="0"/>
    <set name="rewardSp" value="0"/>
    <set name="shots" value="NONE"/>
    <set name="texture" value=""/>
    <set name="type" value="Adventurer"/>
    <equip>
      <rhand item_id="129"/>
      <!--Sword of Revolution-->
      <lhand item_id="102"/>
      <!--Round Shield-->
    </equip>
    <skills>
      <skill id="4416" level="14"/>
      <!--Humans-->
    </skills>
    <attributes>
      <defence attribute="fire" value="0"/>
      <defence attribute="water" value="0"/>
      <defence attribute="wind" value="0"/>
      <defence attribute="earth" value="0"/>
      <defence attribute="holy" value="0"/>
      <defence attribute="unholy" value="0"/>
    </attributes>
  </npc>
  <npc id="31803" name="Adventure Guildsman" title="">
    <set name="aggroRange" value="0"/>
    <set name="ai_type" value="CharacterAI"/>
    <set name="baseAtkRange" value="40"/>
    <set name="baseCON" value="43"/>
    <set name="baseCritRate" value="40"/>
    <set name="baseDEX" value="30"/>
    <set name="baseHpMax" value="2444.468"/>
    <set name="baseHpRate" value="1"/>
    <set name="baseHpReg" value="7.5"/>
    <set name="baseINT" value="21"/>
    <set name="baseMAtk" value="780"/>
    <set name="baseMAtkSpd" value="333"/>
    <set name="baseMDef" value="382"/>
    <set name="baseMEN" value="20"/>
    <set name="baseMpMax" value="1345.8"/>
    <set name="baseMpReg" value="2.7"/>
    <set name="basePAtk" value="1303"/>
    <set name="basePAtkSpd" value="253"/>
    <set name="basePDef" value="471"/>
    <set name="baseRunSpd" value="120"/>
    <set name="baseSTR" value="40"/>
    <set name="baseShldDef" value="0"/>
    <set name="baseShldRate" value="0"/>
    <set name="baseWIT" value="20"/>
    <set name="baseWalkSpd" value="48"/>
    <set name="collision_height" value="26.0"/>
    <set name="collision_radius" value="8.0"/>
    <set name="level" value="70"/>
    <set name="rewardExp" value="0"/>
    <set name="rewardRp" value="0"/>
    <set name="rewardSp" value="0"/>
    <set name="shots" value="NONE"/>
    <set name="texture" value=""/>
    <set name="type" value="Adventurer"/>
    <skills>
      <skill id="4416" level="17"/>
      <!--Orcs-->
    </skills>
    <attributes>
      <defence attribute="fire" value="0"/>
      <defence attribute="water" value="0"/>
      <defence attribute="wind" value="0"/>
      <defence attribute="earth" value="0"/>
      <defence attribute="holy" value="0"/>
      <defence attribute="unholy" value="0"/>
    </attributes>
  </npc>
  <npc id="31804" name="Adventure Guildsman" title="">
    <set name="aggroRange" value="0"/>
    <set name="ai_type" value="CharacterAI"/>
    <set name="baseAtkRange" value="40"/>
    <set name="baseCON" value="43"/>
    <set name="baseCritRate" value="40"/>
    <set name="baseDEX" value="30"/>
    <set name="baseHpMax" value="2444.468"/>
    <set name="baseHpRate" value="1"/>
    <set name="baseHpReg" value="7.5"/>
    <set name="baseINT" value="21"/>
    <set name="baseMAtk" value="780"/>
    <set name="baseMAtkSpd" value="333"/>
    <set name="baseMDef" value="382"/>
    <set name="baseMEN" value="20"/>
    <set name="baseMpMax" value="1345.8"/>
    <set name="baseMpReg" value="2.7"/>
    <set name="basePAtk" value="1303"/>
    <set name="basePAtkSpd" value="253"/>
    <set name="basePDef" value="471"/>
    <set name="baseRunSpd" value="120"/>
    <set name="baseSTR" value="40"/>
    <set name="baseShldDef" value="0"/>
    <set name="baseShldRate" value="0"/>
    <set name="baseWIT" value="20"/>
    <set name="baseWalkSpd" value="48"/>
    <set name="collision_height" value="23.0"/>
    <set name="collision_radius" value="8.0"/>
    <set name="level" value="70"/>
    <set name="rewardExp" value="0"/>
    <set name="rewardRp" value="0"/>
    <set name="rewardSp" value="0"/>
    <set name="shots" value="NONE"/>
    <set name="texture" value=""/>
    <set name="type" value="Adventurer"/>
    <equip>
      <rhand item_id="224"/>
      <!--Maingauche-->
    </equip>
    <skills>
      <skill id="4416" level="16"/>
      <!--Dark Elves-->
    </skills>
    <attributes>
      <defence attribute="fire" value="0"/>
      <defence attribute="water" value="0"/>
      <defence attribute="wind" value="0"/>
      <defence attribute="earth" value="0"/>
      <defence attribute="holy" value="0"/>
      <defence attribute="unholy" value="0"/>
    </attributes>
  </npc>
  <npc id="31805" name="Adventure Guildsman" title="">
    <set name="aggroRange" value="0"/>
    <set name="ai_type" value="CharacterAI"/>
    <set name="baseAtkRange" value="40"/>
    <set name="baseCON" value="43"/>
    <set name="baseCritRate" value="40"/>
    <set name="baseDEX" value="30"/>
    <set name="baseHpMax" value="2444.468"/>
    <set name="baseHpRate" value="1"/>